url,full_title_tesim,spotlight_upload_attribution_tesim,spotlight_upload_date_tesim
http://library.ucsd.edu/dc/object/bb8601935t/_2.jpg,"Ren bu fan wo, wo bu fan ren, ren ruo fan wo, wo bi fan ren",,1970
http://library.ucsd.edu/dc/object/bb5325458j/_1_2.jpg,Zhi qu Weihu Shan: ge min xian dai jing ju,,1970
http://library.ucsd.edu/dc/object/bb28680966/_2.jpg,Hui zhan nian dai,"Zhao, Zhitian, 1940-",1975
http://library.ucsd.edu/dc/object/bb92162750/_2.jpg,Rang zhe xue bian wei qun zhong shou li de jian rui wu qi,"Tianjin Shi gong ye zhan lan guan, Ge ming wei yuan hui",1971
http://library.ucsd.edu/dc/object/bb9557574s/_2.jpg,Mao zhu xi shi shi jie ren min xin zhong de hong tai yang,,1967
http://library.ucsd.edu/dc/object/bb7066084n/_2.jpg,Yi qie fan dong pai dou shi zhi lao hu,,1968
http://library.ucsd.edu/dc/object/bb0922685m/_2.jpg,Zhi qu Weihu Shan: ge min xian dai jing ju,,1970
http://library.ucsd.edu/dc/object/bb9318665g/_2.jpg,Hua zhu xi zai Yi liu liu zhong xue jia zhang hui shang,"Shu, Junci; Wang, Zhaoqing; Wen, Guozhang; Zhao, Shiying",1977
http://library.ucsd.edu/dc/object/bb4711115r/_2.jpg,"Quan shi jie wu chan zhe, lian he qi lai!",Jie fang jun hua bao she,1971
http://library.ucsd.edu/dc/object/bb0205955k/_2.jpg,Bo Hai yu ge,"Zhang, Enjei",1974
http://library.ucsd.edu/dc/object/bb08202954/_2.jpg,Zhan shi hai,"Hechi Diqu (China), Wen hua ju; Huang, Zonghai",1975
http://library.ucsd.edu/dc/object/bb4472207d/_2.jpg,Hongqi qu,Ren min mei shu chu ban she,1972
http://library.ucsd.edu/dc/object/bb38237365/_2.jpg,Zhi qu Weihu Shan: ge min xian dai jing ju,,1970
http://library.ucsd.edu/dc/object/bb3516566j/_2.jpg,Zu guo jian she xin cheng jiu,,197u
http://library.ucsd.edu/dc/object/bb5393714q/_2.jpg,Hong deng ji: ge ming xian dai jing ju,,1970
http://library.ucsd.edu/dc/object/bb2526794x/_2.jpg,Yan bao jian cao tu jie: Yan bao jian cao tu jie,"Shanghai Shi yan bing pi fu bing fang zhi suo; Zhang, Yihao",1979
http://library.ucsd.edu/dc/object/bb3482435s/_2.jpg,Da bu jin chai lang jue bu xia zhan chang,,1970
http://library.ucsd.edu/dc/object/bb6042184c/_2.jpg,Shuang yu ji qing,"An, Weixin; Tianjin Yangliuqing hua she",1989
http://library.ucsd.edu/dc/object/bb2799835k/_2.jpg,Yi ding yao jie fang Taiwan: We are determined to liberate Taiwan! = Nous libérerons Taiwan! = Wir werden Taïwan unbedingt befreien!,Shanghai Shi chu ban ge ming zu,1967
http://library.ucsd.edu/dc/object/bb5052414d/_2.jpg,Jing zhu Mao zhu xi wan shou wu jiang,,1967
http://library.ucsd.edu/dc/object/bb6008054f/_2.jpg,Wo men zui jing ai de wei da ling xiu Mao zhu xi he ta de qing mi zhan you Lin Biao tong zhi zai yi qi,,1967
http://library.ucsd.edu/dc/object/bb2117235z/_2.jpg,Taiwan tong bao wo de gu rou xiong di,"Yang, Yingbiao",1976
http://library.ucsd.edu/dc/object/bb9659963r/_2.jpg,Zhonghua Renmin Gongheguo wan sui,"Shen, Shaolun; Wang, Weixu",1974
http://library.ucsd.edu/dc/object/bb80217254/_2.jpg,"Wei wei da ling xiu Mao zhu xi zheng guang, wei wei da she hui zhu yi zu guo zheng guang",Zhong yang gong yi mei shu xue yuan (China),1970
http://library.ucsd.edu/dc/object/bb63834877/_2.jpg,Ying feng fei yan,"Chen, Zongwu; Pei, Kaixin; Zhang, Guang; Zhang, Huoming",1975
http://library.ucsd.edu/dc/object/bb1912456q/_2.jpg,Shi zuo hong deng ji cheng ren,,1970
http://library.ucsd.edu/dc/object/bb4130906n/_2.jpg,"Xiang Wang Guofu tong zhi xue xi!: ""La ge ming che bu song tao, yi zhi la dao gong chan zhu yi""",,1970
http://library.ucsd.edu/dc/object/bb2185495k/_2.jpg,"She hui zhu yi hao: Socialism is fine = Le socialisme, c'est bien! = Der Sozialismus ist gut!",,1968
http://library.ucsd.edu/dc/object/bb08885554/_2.jpg,Chun yu,"Zhong, Zhaolin",1975
http://library.ucsd.edu/dc/object/bb9864745x/_2.jpg,Yan'an jing shen fang guang mang,,1971
http://library.ucsd.edu/dc/object/bb7680427f/_2.jpg,"Resolutely support the anti-imperialist struggles of the people of Asia, Africa and Latin America: Soutenir fermement la lutte anti-impérialiste des peoples d'Asie, d'Afrique et d'Amérique latine = Firme apoyo a la lucha antiimperialista de los pueblos de Asia, Africa y América Latina",,1967
http://library.ucsd.edu/dc/object/bb1502896p/_2.jpg,The evil system of colonialism and imperialism,,1968
http://library.ucsd.edu/dc/object/bb3414177k/_2.jpg,Bing min shi sheng li zhi ben,Beijing Shi 76 zhong xue,1970
http://library.ucsd.edu/dc/object/bb82947665/_2.jpg,Shan shan de hong xing,Ba yi dian ying zhi pian chang,1975
http://library.ucsd.edu/dc/object/bb7919335j/_2.jpg,"""Wu · qi zhi shi"" wan sui!","China, Zhongguo ren min jie fang jun., Chengdu bu dui",1971
http://library.ucsd.edu/dc/object/bb8260634f/_2.jpg,"Quan shi jie ren min tuan jie qi lai, da bai Meiguo qin lüe zhe ji qi yi qie zou gou!","Beijing liao qi chang, Ge wei hui., Zheng gong zu",1971
http://library.ucsd.edu/dc/object/bb6349354r/_2.jpg,Mao zhu xi zai Jinggangshan nong cun diao cha,,1971
http://library.ucsd.edu/dc/object/bb7646295v/_2.jpg,Quan shi jie ren min tuan jie qi lai,,1968
http://library.ucsd.edu/dc/object/bb9933005n/_2.jpg,Ren min zhan zheng sheng li wan sui: Ren min zhan zheng sheng li wan sui,"Shanghai ren min mei shu chu ban she, Xuan chuan hua zu",1966
http://library.ucsd.edu/dc/object/bb6963694c/_2.jpg,"Yong yuan xue xi ""Lao san pian"": Yong yuan xue xi Lao san pian","Shanghai ren min chu ban she, Nian hua chuang zuo zu",1966
http://library.ucsd.edu/dc/object/bb18100667/_2.jpg,Mei di guo zhu yi cong Yuenan nan fang gun chu qu!: Mei di guo zhu yi cong Yue Nan nan fang gun chu qu,"Ha, Qiongwen, 1925-",1963
http://library.ucsd.edu/dc/object/bb8636066z/_2.jpg,Zhi qu Weihu Shan: ge min xian dai jing ju,,1970
http://library.ucsd.edu/dc/object/bb6622397m/_2.jpg,Jin mi di tuan jie zai yi Hua zhu xi wei shou de dang zhong yang zhou wei duo qu geng da de sheng li,"China, Zhongguo ren min jie fang jun., Bu dui, 37001",1977
http://library.ucsd.edu/dc/object/bb11615959/_2.jpg,"Yan zhe Mao zhu xi ""Wu qi zhi shi"" de guang hui da dao fen yong qian jin!",Zhongguo ren min ge ming jun shi bo wu guan,1971
http://library.ucsd.edu/dc/object/bb3755476c/_2.jpg,"Ni ban shi, wo fang xin: Ni ban shi, wo fang xin","Chen, Beixin, 1932-; Huang, Naiyuan, 1931-2004; Liu, Wenxi, 1933-; Qin, Dajian",1977
http://library.ucsd.edu/dc/object/bb8363024v/_2.jpg,Sheng li qian jin,,1970
http://library.ucsd.edu/dc/object/bb67247873/_2.jpg,"Da yi ling ran, ning si bu qu",,1970
http://library.ucsd.edu/dc/object/bb0274215r/_2.jpg,Zhi qu Weihu Shan: ge min xian dai jing ju,,1970
http://library.ucsd.edu/dc/object/bb5769145q/_2.jpg,Ji nian Baiqiu'en,"Beijing dian ying xue yuan, Dong fang hong gong she., Hong hua bing; Shou du da zhuan yuan xiao hong dai hui",1967
http://library.ucsd.edu/dc/object/bb0547258c/_2.jpg,Si ye bu zuo nu li,,1971
http://library.ucsd.edu/dc/object/bb9250405j/_2.jpg,Tian han xin nuan,"Wang, Renjie",1977
http://library.ucsd.edu/dc/object/bb9591707w/_2.jpg,Wu xian feng guang zai xian feng,"Pan, Jinba, 1939-; Xia, Ye",1976
http://library.ucsd.edu/dc/object/bb31752655/_2.jpg,Hun shen shi dan xiong jiu jiu,,1970
http://library.ucsd.edu/dc/object/bb5427847h/_2.jpg,Chun man da di,"Wu, Yunhua, 1944-",1976
http://library.ucsd.edu/dc/object/bb7339126c/_2.jpg,Yi wan ren min de gong tong xin yuan: re lie qing zhu Mao zhu xi ji nian tang sheng li jian cheng,"Cui, Kaixi; Gao, Quan",1977
http://library.ucsd.edu/dc/object/bb69978256/_2.jpg,Hong deng ji: ge ming xian dai jing ju,,1970
http://library.ucsd.edu/dc/object/bb8909104m/_2.jpg,"Sheng ming bu xi, chong feng bu zhi","Zhongguo ren min ge ming jun shi bo wu guan, Mei shu zu",1970
http://library.ucsd.edu/dc/object/bb24585379/_2.jpg,Wu chan jie ji zhuan zheng wan sui!: Long live the dictatorship of the proletariat! = Vive la dictature du prolétariat! = Es lebe die Diktatur des Proletariats!,Shanghai ren min chu ban she,1968
http://library.ucsd.edu/dc/object/bb73049943/_2.jpg,Qian li ye ying lian hong xin,"Shanghai bo li qi min 3 chang, Ge wei hui., Zheng xuan zu; Xuhui Qu fang wu xiu jian gong si, Di 3 gong cheng dui., Ge wei hui., Zheng xuan zu",1971
http://library.ucsd.edu/dc/object/bb7953464z/_2.jpg,Fa yang ge ming chuan tong yong yuan qian jin,"Beijing niang jiu zong chang, Ye yu mei shu zu",1971
http://library.ucsd.edu/dc/object/bb3072875r/_2.jpg,Rang zhe xue bian wei qun zhong shou li de jian rui wu qi,Beijing Shi 76 zhong xue,1971
http://library.ucsd.edu/dc/object/bb2219625f/_2.jpg,Ta bian qing shan,"Jiang, Huaqing",1977
http://library.ucsd.edu/dc/object/bb4438075t/_2.jpg,Fei bing qi xi Shangjiabang,,1970
http://library.ucsd.edu/dc/object/bb56667559/_2.jpg,Zhi qu Weihu Shan: ge min xian dai jing ju,,1970
http://library.ucsd.edu/dc/object/bb50865464/_2.jpg,Hong deng ji: ge ming xian dai jing ju,,1970
http://library.ucsd.edu/dc/object/bb57350172/_2.jpg,Hong deng ji: ge ming xian dai jing ju,,1970
http://library.ucsd.edu/dc/object/bb1571154t/_2.jpg,Liang bu wan de xin tian,"Liao, Liangui",1974
http://library.ucsd.edu/dc/object/bb1844196x/_2.jpg,Chang cheng hao han,"Wen, Jun; Yulin Diqu ge ming wei yuan hui, Wen jiao ju",1974
http://library.ucsd.edu/dc/object/bb4096774h/_2.jpg,Baiqiu'en,Shanghai ge ming jiao yu chu ban she,1968
http://library.ucsd.edu/dc/object/bb4779376n/_2.jpg,Feng shou mang,"Qin, Yongchun",1968
http://library.ucsd.edu/dc/object/bb3141135g/_2.jpg,Shan cun yun dong hui,"Wen, Guoliang",1975
http://library.ucsd.edu/dc/object/bb4369815q/_2.jpg,Bali gong she wan sui!: ji nian Bali gong she yi bai zhou nian,"Shanghai xi ju xue yuan, Ge wei hui",1971
http://library.ucsd.edu/dc/object/bb0615515m/_2.jpg,Hua Guofeng zhu xi,,1976
http://library.ucsd.edu/dc/object/bb1229854b/_2.jpg,Fu shou ru yi,"An, Weixin; Tianjin Yangliuqing hua she",1989
http://library.ucsd.edu/dc/object/bb6690655t/_2.jpg,Dui li xin shi hua bu wan,"Min, Caibin; Nanhui Xian ye yu mei shu chuang zuo zu",1977
http://library.ucsd.edu/dc/object/bb8977365r/_2.jpg,"We da de dao shi, wei da de ling xiu, we da de tong shuai, wei da de duo shou, Mao zhu xi wan sui!",,1967
http://library.ucsd.edu/dc/object/bb0513124m/_2.jpg,Hong deng ji: ge ming xian dai jing ju,,1970
