url,full_title_tesim,spotlight_upload_attribution_tesim,spotlight_upload_date_tesim
http://library.ucsd.edu/dc/object/bb16735826/_2.jpg,"Hondureños, vamos a vencer!","Flores Facussé, Carlos; Partido Liberal de Honduras",between 1984 and 2009
http://library.ucsd.edu/dc/object/bb91480547/_2.jpg,Diputada de la Sociedad Civil,"Campbell B., Epsy (Campbell Barr); Partido de la Revolución Democrática (Mexico)",between 1984 and 2009
http://library.ucsd.edu/dc/object/bb7236775c/_2.jpg,Costa Rica merece estar mejor,"Araya Monge, Rolando, 1947-; Partido Liberación Nacional",between 1984 and 2009
http://library.ucsd.edu/dc/object/bb3107044z/_2.jpg,Aún nos faltan lugares que ocupar...en el espacio cívico político del país ?participemos todas!,Guatemala. Tribunal Supremo Electoral,between 1984 and 2009
http://library.ucsd.edu/dc/object/bb22537959/_2.jpg,Boleta Electoral Para Representantes Ante La Asamblea Nacional Región 1,Consejo Supremo Electoral (Nicaragua),between 1984 and 2009
http://library.ucsd.edu/dc/object/bb7270902c/_2.jpg,Héctor Silva Presidente,"Centro Democrático Unido (El Salvador); Silva Argüello, Héctor",between 1984 and 2009
http://library.ucsd.edu/dc/object/bb0444905z/_2.jpg,Yo le creo a Daniel,"Frente Sandinista de Liberación Nacional; Ortega, Daniel",between 1984 and 2009
http://library.ucsd.edu/dc/object/bb57009218/_2.jpg,Boleta Electoral Para Representantes A La Asamblea Nacional Región II,Consejo Supremo Electoral (Nicaragua),between 1984 and 2009
http://library.ucsd.edu/dc/object/bb8636104g/_2.jpg,Maduro Future Seguro,"Maduro, Ricardo, 1946-; Partido Nacional de Honduras",between 1984 and 2009
http://library.ucsd.edu/dc/object/bb4267466p/_2.jpg,Partido arnulfista,"Miguel Alemán, José; Partido Arnulfista (Panama)",between 1984 and 2009
http://library.ucsd.edu/dc/object/bb66565628/_2.jpg,Boleta Electoral Para Representantes A La Asamblea Nacional Región III,Consejo Supremo Electoral (Nicaragua),between 1984 and 2009
http://library.ucsd.edu/dc/object/bb1946625f/_2.jpg,Nando Lardizábal,"Lardizábal, Nando; Partido Nacional de Honduras",between 1984 and 2009
http://library.ucsd.edu/dc/object/bb25950941/_2.jpg,Por Nuestra Libertad,Frente Sandinista de Liberación Nacional,between 1984 and 2009
http://library.ucsd.edu/dc/object/bb14005457/_2.jpg,Carlos Flores el hombre que necesita Honduras,"Flores Facussé, Carlos; Partido Liberal de Honduras",between 1984 and 2009
http://library.ucsd.edu/dc/object/bb27316112/_2.jpg,"el 4 de Noviembre, Vota",Frente Sandinista de Liberación Nacional.,between 1984 and 2009
http://library.ucsd.edu/dc/object/bb1332281c/_2.jpg,"Con México, a la victoria","Cárdenas Solórzano, Cuauhtémoc; Partido Demócrata Cristiano (El Salvador)",between 1984 and 2009
http://library.ucsd.edu/dc/object/bb1639453s/_2.jpg,Vamos por más!,"Frente Farabundo Martí para la Liberación Nacional; Fuerzas Populares de Liberación Farabundo Martí; Menjívar, Violeta",between 1984 and 2009
http://library.ucsd.edu/dc/object/bb7851111g/_2.jpg,"Diputada Ileana Rogel, El Salvador","Frente Farabundo Martí para la Liberación Nacional; Rogel, Ileana",between 1984 and 2009
http://library.ucsd.edu/dc/object/bb2390312q/_2.jpg,"Mujer Guatemalteca participar es derecho de todas, hombres y mujers construimos la democracia",Guatemala. Tribunal Supremo Electoral,between 1984 and 2009
http://library.ucsd.edu/dc/object/bb1195765j/_2.jpg,"Suger Presidente, Vota así; CASA Centro de Acción Social","Centro de Acción Social (Guatemala); Centro de Acción Social (Guatemala); Suger Cofiño, Eduardo",between 1984 and 2009
http://library.ucsd.edu/dc/object/bb05472968/_2.jpg,La Solución Somos Todos!,Partido Socialcristiano Nicaragüense,between 1984 and 2009
http://library.ucsd.edu/dc/object/bb01036044/_2.jpg,Matías Presidente,"Funes, Matías; Partido Unificación Democrática (Honduras)",between 1984 and 2009
http://library.ucsd.edu/dc/object/bb43698544/_2.jpg,Este es parte del equipo que hará realidad,Partido Innovación y Unidad (Honduras),between 1984 and 2009
http://library.ucsd.edu/dc/object/bb4403982k/_2.jpg,Elecciones Poder Popular y revolucion,Frente Sandinista de Liberación Nacional,between 1984 and 2009
http://library.ucsd.edu/dc/object/bb0376642m/_2.jpg,Por la construccion del poder obrero campensino,Partido Marxista Leninista de Nicaragua,between 1984 and 2009
http://library.ucsd.edu/dc/object/bb84313253/_2.jpg,Doris Diputada,"Gutiérrez, Doris; Partido Unificación Democrática (Honduras)",between 1984 and 2009
http://library.ucsd.edu/dc/object/bb6520043m/_2.jpg,Ayer guiando a su pueblo,"Consejo Supremo Electoral (Nicaragua); Hassan M., Moisés",between 1984 and 2009
http://library.ucsd.edu/dc/object/bb7748723v/_2.jpg,Las riquezas las producimos los trabajadores,Partido Marxista Leninista de Nicaragua,between 1984 and 2009
http://library.ucsd.edu/dc/object/bb8909142h/_2.jpg,MUR,Movimiento de Unidad Revolucionaria (Nicaragua),between 1984 and 2009
http://library.ucsd.edu/dc/object/bb98306513/_2.jpg,50 Aniversario,Costa Rica. Tribunal Supremo de Elecciones,between 1984 and 2009
http://library.ucsd.edu/dc/object/bb8192415q/_2.jpg,Al congreso por la capital,"Barrera, Mireya; Partido de Avanzada Nacional (Guatemala)",between 1984 and 2009
http://library.ucsd.edu/dc/object/bb4881804w/_2.jpg,En memoria de Schafik Jorge Hándal Hándal,"Frente Farabundo Martí para la Liberación Nacional; Hándal, Schafik Jorge; Romero, Oscar A. (Oscar Arnulfo), 1917-1980",between 1984 and 2009
http://library.ucsd.edu/dc/object/bb7782856b/_2.jpg,Ricardo Perdomo Alcalde,"Movimiento Renovador (El Salvador); Perdomo, Ricardo",between 1984 and 2009
http://library.ucsd.edu/dc/object/bb7885246r/_2.jpg,La Via Democratica Para Liberar Nicaragua,Unidad Nicaragüense Opositora,between 1984 and 2009
http://library.ucsd.edu/dc/object/bb98647829/_2.jpg,Boleta Electoral Para Representantes A La Asamblea Nacional Zona Especial II,Consejo Supremo Electoral (Nicaragua),between 1984 and 2009
http://library.ucsd.edu/dc/object/bb9182183n/_2.jpg,"Alianza Nueva Nación; Vota asi, Comdandante Pablo Monsanto, Presidente","Alianza Nueva Nación (Guatemala); Monsanto, Pablo",between 1984 and 2009
http://library.ucsd.edu/dc/object/bb0001216p/_2.jpg,Lo dice la gente! Endara Presidente,"Endara Galimany, Guillermo; Partido Unión Patriótica (Panama); Partido Unión Patriótica (Panama)",between 1984 and 2009
http://library.ucsd.edu/dc/object/bb94210910/_2.jpg,Vota con mano dura; Otto Pérez Molina Presidente,"Partido Patriota (Guatemala); Pérez Molina, Otto",between 1984 and 2009
http://library.ucsd.edu/dc/object/bb1844233x/_2.jpg,XXVI Aniversario|Centro Monseñor Romero; Me glorió de estar en medio de mi pueblo,"Romero, Oscar A. (Oscar Arnulfo), 1917-1980; Universidad Centroamericana José Simeón Cañas. Centro Monseñor Romero",between 1984 and 2009
http://library.ucsd.edu/dc/object/bb7509812h/_2.jpg,Un Cambio Seguro,"Frente Farabundo Martí para la Liberación Nacional; Funes, Carlos Mauricio",between 1984 and 2009
http://library.ucsd.edu/dc/object/bb40626858/_2.jpg,Diputados por la capital 2008-2012,"Alonzo, Alfonso; Orozco, Angélica; Ortega, Jorge Luis; Union Democrática",between 1984 and 2009
http://library.ucsd.edu/dc/object/bb49841935/_2.jpg,Boleta Electoral Para Representantes Ante La Asamblea Nacional Región 8,Consejo Supremo Electoral (Nicaragua),between 1984 and 2009
http://library.ucsd.edu/dc/object/bb5359622p/_2.jpg,Boleta Electoral Para Representantes A La Asamblea Nacional Región IV,Consejo Supremo Electoral (Nicaragua),between 1984 and 2009
http://library.ucsd.edu/dc/object/bb95917448/_2.jpg,"Tus Diputados, Cambiemos el Rubmo del País","Centro Democrático Unido (El Salvador); Dada Hirezi, Héctor; Zamora, Rubén",between 1984 and 2009
http://library.ucsd.edu/dc/object/bb3960293w/_2.jpg,Marvin Ponce Alcalde,"Partido Unificación Democrática (Honduras); Ponce, Marvin",between 1984 and 2009
http://library.ucsd.edu/dc/object/bb0683813r/_2.jpg,Boleta Electoral Para Representantes A La Asamblea Nacional Zona Especial I,Consejo Supremo Electoral (Nicaragua),between 1984 and 2009
http://library.ucsd.edu/dc/object/bb4711153n/_2.jpg,"Rolando Presidente, Costa Rica merece estar mejor","Araya Monge, Rolando, 1947-; Partido Liberación Nacional",between 1984 and 2009
http://library.ucsd.edu/dc/object/bb6315262z/_2.jpg,Nedis Licona Diputado,"Licona, Nedis; Partido Unificación Democrática (Honduras)",between 1984 and 2009
http://library.ucsd.edu/dc/object/bb76122025/_2.jpg,"Asegurarse; con Javier Solís, Manuel Mora Salas, y Luis Fernando Astorga; Diputados por San José","Astorga, Luís Fernando; Mora Salas, Manuel; Pueblo Unido (Political party: Costa Rica); Solís, Javier",between 1984 and 2009
http://library.ucsd.edu/dc/object/bb99330421/_2.jpg,Tu esperanza es nuestro compromiso,"Colom, Álvaro, 1951-; Espada, Rafael; Unidad Nacional de la Esperanza (Guatemala)",between 1984 and 2009
http://library.ucsd.edu/dc/object/bb4642892d/_2.jpg,"Es un hecho: vamos todos a vivir mejor; Calderón Sol, Presidente","Alianza Republicana Nacionalista (El Salvador); Bustamante, Enrique Borgo; Bustamante, Enrique Borgo; Calderón Sol, Armando",between 1984 and 2009
http://library.ucsd.edu/dc/object/bb6997862k/_2.jpg,Diputada Celina de Monterrosa,"Frente Farabundo Martí para la Liberación Nacional; de Monterrosa, Celina",between 1984 and 2009
http://library.ucsd.edu/dc/object/bb9250444z/_2.jpg,"Iriarte Presidente, 1994-1998","Orlando Iriarte, Marco; Partido Demócrata Cristiano de Honduras",between 1984 and 2009
http://library.ucsd.edu/dc/object/bb95234820/_2.jpg,Garantizamos,"Molina, Eduardo; Partido Conservador Demócrata de Nicaragua; Torres, Hugo",between 1984 and 2009
http://library.ucsd.edu/dc/object/bb7475684p/_2.jpg,Yo voto por mi libertad,Alianza Republicana Nacionalista (El Salvador),between 1984 and 2009
http://library.ucsd.edu/dc/object/bb6451781v/_2.jpg,Virgilio Vicepresidente,"Godoy Reyes, Virgilio; Unión Nacional Opositora (Nicaragua)",between 1984 and 2009
http://library.ucsd.edu/dc/object/bb4608762g/_2.jpg,Diputado por la capital,"Partido de Avanzada Nacional (Guatemala); Urrea, Juan Pablo",between 1984 and 2009
http://library.ucsd.edu/dc/object/bb68954723/_2.jpg,Seguimos de frente...con el Frente!,Frente Sandinista de Liberación Nacional,between 1984 and 2009
http://library.ucsd.edu/dc/object/bb1093374j/_2.jpg,Schafik y Tania Seguimos Luchando!,"Frente Farabundo Martí para la Liberación Nacional; Hándal, Schafik Jorge",between 1984 and 2009
http://library.ucsd.edu/dc/object/bb65541718/_2.jpg,Presidente Daniel,"Frente Sandinista de Liberación Nacional; Ortega, Daniel",between 1984 and 2009
http://library.ucsd.edu/dc/object/bb3243563v/_2.jpg,Vota FMLN,Frente Farabundo Martí para la Liberación Nacional,between 1984 and 2009
http://library.ucsd.edu/dc/object/bb08885910/_2.jpg,Vota Así,"Partido Patriota (Guatemala); Pérez Molina, Otto",between 1984 and 2009
http://library.ucsd.edu/dc/object/bb8465451q/_2.jpg,Seguimos con Ramoncito,"Ashby Chial, Ramoncito; Partido Revolucionario Democrático (Panama)",between 1984 and 2009
http://library.ucsd.edu/dc/object/bb7134388f/_2.jpg,Por La Reforma Agraria,Frente Sandinista de Liberación Nacional,between 1984 and 2009
http://library.ucsd.edu/dc/object/bb2799873g/_2.jpg,FMLN,Frente Farabundo Martí para la Liberación Nacional,between 1984 and 2009
http://library.ucsd.edu/dc/object/bb4199201x/_2.jpg,Pineda Ponce Un Presidente Para Todos,"Partido Liberal de Honduras; Pineda Ponce, Rafael",between 1984 and 2009
http://library.ucsd.edu/dc/object/bb2970523x/_2.jpg,Partido Vanguardia Popular,Partido Vanguardia Popular (Costa Rica),between 1984 and 2009
http://library.ucsd.edu/dc/object/bb48135455/_2.jpg,"Rincón Gallardo Presidente; Democracia social, vota diferente","Partido Comunista Mexicano; Partido Mexicano Socialista; Partido Socialista Unificado de México; Partido de la Revolución Democrática (Mexico); Rincón Gallardo, Gilberto",between 1984 and 2009
http://library.ucsd.edu/dc/object/bb0717941z/_2.jpg,"11 de abril de 1991; Héroes del Zapote, ?hasta la victoria siempre!","Cardenal Caldera, Antonio; Frente Farabundo Martí para la Liberación Nacional; Rojas, Jesús",between 1984 and 2009
http://library.ucsd.edu/dc/object/bb5223106k/_2.jpg,Alfonso Cabrera Diputado por Lista Nacional,"Frente Republicano Guatemalteco; Portillo, Alfonso",between 1984 and 2009
http://library.ucsd.edu/dc/object/bb5496141h/_2.jpg,Mario Molina Diputado,Movimiento Renovador (El Salvador),between 1984 and 2009
http://library.ucsd.edu/dc/object/bb7953502g/_2.jpg,"Diputado Walter Durán, El Salvador","Durán, Walter; Frente Farabundo Martí para la Liberación Nacional",between 1984 and 2009
http://library.ucsd.edu/dc/object/bb6042222w/_2.jpg,Presidente Calderón Sol,"Alianza Republicana Nacionalista (ARENA); Calderón Sol, Armando",between 1984 and 2009
http://library.ucsd.edu/dc/object/bb56667936/_2.jpg,Honduras necesita un Presidente.,"Azcona H., José; Partido Liberal de Honduras",between 1984 and 2009
http://library.ucsd.edu/dc/object/bb33118245/_2.jpg,País Justo: Progreso con Equidad,"Alianza Republicana Nacionalista (El Salvador); Ávila, Rodrigo, 1964-",between 1984 and 2009
http://library.ucsd.edu/dc/object/bb97623919/_2.jpg,Oswaldo Presidente,"Partido Nacional de Honduras; Ramos Soto, Oswaldo",between 1984 and 2009
http://library.ucsd.edu/dc/object/bb4301591k/_2.jpg,Historia de El Salvador,Equipo Maíz,between 1984 and 2009
http://library.ucsd.edu/dc/object/bb5871574v/_2.jpg,Boleta Electoral Para Presidente Y Vicepresidente,Consejo Supremo Electoral (Nicaragua),between 1984 and 2009
http://library.ucsd.edu/dc/object/bb3550733g/_2.jpg,Vota con mano dura; Otto Pérez Molina Presidente,"Partido Patriota (Guatemala); Pérez Molina, Otto",between 1984 and 2009
http://library.ucsd.edu/dc/object/bb9079794h/_2.jpg,Symbols of Nicaraguan political parties,Movimiento Democrático Nicaragüense; Movimiento de Unidad Revolucionaria (Nicaragua); Partido Comunista (Nicaragua); Partido Liberal de Unidad Nacional (Nicaragua); Partido Marxista Leninista de Nicaragua; Partido Nacional Conservador; Partido Neo-liberal (Nicaragua); Partido Revolucionario de los Trabajadores (Nicaragua); Partido Social Demócrata de Nicaragua; Partido Unionista Centroamericano,between 1984 and 2009
http://library.ucsd.edu/dc/object/bb45405032/_2.jpg,Una diputada que ya trabajó para ti y tus hijos,"Frente Republicano Guatemalteco; Marroquín Godoy, Lucrecia",between 1984 and 2009
http://library.ucsd.edu/dc/object/bb2356185q/_2.jpg,Soluciones de verdad!,"Frente Farabundo Martí para la Liberación Nacional; Fuerzas Populares de Liberación Farabundo Martí; Menjívar, Violeta",between 1984 and 2009
http://library.ucsd.edu/dc/object/bb7339165s/_2.jpg,Juan Ramon Medrano Diputado,"Medrano, Juan Ramón; Partido Social Demócrata de El Salvador",between 1984 and 2009
http://library.ucsd.edu/dc/object/bb0035343t/_2.jpg,Vota coalición,Frente Farabundo Martí para la Liberación Nacional; Movimiento Nacional Revolucionario (El Salvador); Partido Cambio Democrático (El Salvador),between 1984 and 2009
http://library.ucsd.edu/dc/object/bb8124152x/_2.jpg,"Costa Rica, necesita tu voto","Arias Sánchez, Óscar; Partido Liberación Nacional",between 1984 and 2009
http://library.ucsd.edu/dc/object/bb20490146/_2.jpg,El Tribunal Supremo de Elecciones,Costa Rica..Tribunal Supremo de Elecciones,between 1984 and 2009
http://library.ucsd.edu/dc/object/bb71685114/_2.jpg,"Diputada Blanca Noemi Coto, El Salvador","Coto, Blanca Noemi; Frente Farabundo Martí para la Liberación Nacional",between 1984 and 2009
http://library.ucsd.edu/dc/object/bb9489354j/_2.jpg,"Álvaro González E., Presidente 1998-2002","González Espinosa, Álvaro; Partido Demócrata (Costa Rica : 1941- )",between 1984 and 2009
http://library.ucsd.edu/dc/object/bb67930834/_2.jpg,Porque somos la tierra que fecunda la democracia; Participemos todas en espacio cívico político del país,Guatemala. Tribunal Supremo Electoral,between 1984 and 2009
http://library.ucsd.edu/dc/object/bb85678416/_2.jpg,Pido tu voto porque Honduras merece un destino mejor,"Díaz Arrivillaga, Efraín; Partido Demócrata Cristiano de Honduras",between 1984 and 2009
http://library.ucsd.edu/dc/object/bb61104822/_2.jpg,Para denuncias o información acerca de delitos electorales federales la FEPADE está a tu servicio,Mexico. Procuraduría General de la República,between 1984 and 2009
http://library.ucsd.edu/dc/object/bb2117273v/_2.jpg,Con Cuauhtémoc Cardenas y Andres Manuel Lopez Obrador; Vamos on México a la Victoria,"Alianza por México; Cárdenas Solórzano, Cuauhtémoc; López Obrador, Andrés Manuel; Partido de la Revolución Democrática (Mexico)",between 1984 and 2009
http://library.ucsd.edu/dc/object/bb1434671v/_2.jpg,"Nueva Izquierda, Senado y Diputados","Democracia Social (Political party :Mexico); Rincon Gallardo, Gilberto",between 1984 and 2009
http://library.ucsd.edu/dc/object/bb1741843h/_2.jpg,Diputado Humberto Centeno,"Centeno, Humberto; Frente Farabundo Martí para la Liberación Nacional",between 1984 and 2009
http://library.ucsd.edu/dc/object/bb66224333/_2.jpg,Rescatemos al Congreso!,"Encuentro por Guatemala (Political party); García, Aníbal; Montenegro, Nineth; Velásquez, Alvaro; Vásquez, Sheny",between 1984 and 2009
http://library.ucsd.edu/dc/object/bb2629221b/_2.jpg,Cambiemos el rumbo del país!,"Centro Democrático Unido (El Salvador); Dada Hirezi, Héctor; Silva, Héctor; Zamora, Rubén",between 1984 and 2009
http://library.ucsd.edu/dc/object/bb4915935n/_2.jpg,Un presidente para todos los hondureños 1986-1990,"Partido Nacional de Honduras; Reyes Mazzoni, Gregorio",between 1984 and 2009
http://library.ucsd.edu/dc/object/bb3414216m/_2.jpg,Boleta Electoral Para Representantes Ante La Asamblea Nacional Región 5,Consejo Supremo Electoral (Nicaragua),between 1984 and 2009
http://library.ucsd.edu/dc/object/bb0479031h/_2.jpg,Unionista si - 2007 presidential election; con Fritz y Quique Guatemala Cambiará,"García-Gallont, Fritz; Godoy García-Granados, Enrique; Partido Unionista (Guatemala)",between 1984 and 2009
http://library.ucsd.edu/dc/object/bb8738496c/_2.jpg,Rodrigo Ávila: Alcalde por Santa Tecla,"Alianza Republicana Nacionalista (El Salvador); Ávila, Rodrigo, 1964-",between 1984 and 2009
http://library.ucsd.edu/dc/object/bb9386965n/_2.jpg,Una cara nueva al congreso por la capital,"Camacho, Carmen; Partido de Avanzada Nacional (Guatemala)",between 1984 and 2009
http://library.ucsd.edu/dc/object/bb6178745m/_2.jpg,Entre la unidad y liberación,Pueblo Unido (Political party : Costa Rica),between 1984 and 2009
http://library.ucsd.edu/dc/object/bb87043634/_2.jpg,Martin Torrijos Presidente,"Partido Revolucionario Democrático (Panama); Torrijos, Martín",between 1984 and 2009
http://library.ucsd.edu/dc/object/bb09909848/_2.jpg,Boleta Electoral Para Representantes A La Asamblea Nacional Región V,Consejo Supremo Electoral (Nicaragua),between 1984 and 2009
http://library.ucsd.edu/dc/object/bb4745282t/_2.jpg,PSC (with Fish emblem),Partido Socialcristiano Nicaragüense,between 1984 and 2009
http://library.ucsd.edu/dc/object/bb51548418/_2.jpg,Carlos Flores Presidente,"Flores Facussé, Carlos; Partido Liberal de Honduras",between 1984 and 2009
http://library.ucsd.edu/dc/object/bb8806753m/_2.jpg,"Un cambio seguro, Mauricio Presidente","Frente Farabundo Martí para la Liberación Nacional; Funes, Carlos Mauricio",between 1984 and 2009
http://library.ucsd.edu/dc/object/bb3926164g/_2.jpg,Rolando Presidente PLN,"Araya Monge, Rolando, 1947-; Partido Liberación Nacional",between 1984 and 2009
http://library.ucsd.edu/dc/object/bb8226542d/_2.jpg,Tu Voto Decide,Consejo Supremo Electoral (Nicaragua),between 1984 and 2009
http://library.ucsd.edu/dc/object/bb24585756/_2.jpg,Ahora le toca a la gente!,"Frente Republicano Guatemalteco; Rabbé, Luis, 1956-",between 1984 and 2009
http://library.ucsd.edu/dc/object/bb3755513c/_2.jpg,Oye Managua con Sandino,Frente Sandinista de Liberación Nacional,between 1984 and 2009
http://library.ucsd.edu/dc/object/bb5973964b/_2.jpg,Mauricio Presidente,"Frente Farabundo Martí para la Liberación Nacional; Funes, Carlos Mauricio",between 1984 and 2009
http://library.ucsd.edu/dc/object/bb55985310/_2.jpg,Nora; porque quere y entiende al pueblo,,between 1984 and 2009
http://library.ucsd.edu/dc/object/bb3004654j/_2.jpg,"Alcalde Lic. Carlos López, Santiago Nonualco",Frente Farabundo Martí para la Liberación Nacional,between 1984 and 2009
http://library.ucsd.edu/dc/object/bb5257231p/_2.jpg,"Presionar, Amenazar, Obligar o Condicionar tu voto son delitos; denúncialos - El voto es tu mejor voz",Instituto Federal Electoral (Mexico),between 1984 and 2009
http://library.ucsd.edu/dc/object/bb5325495x/_2.jpg,Defendamos el colón a la dolarización,Frente Farabundo Martí para la Liberación Nacional,between 1984 and 2009
http://library.ucsd.edu/dc/object/bb88408842/_2.jpg,El cambio es hoy!,"Frente Farabundo Martí para la Liberación Nacional; Mata Bennett, Guillermo",between 1984 and 2009
http://library.ucsd.edu/dc/object/bb2151405f/_2.jpg,Boleta Electoral Para Representantes A La Asamblea Nacional Zona Especial III,Consejo Supremo Electoral (Nicaragua),between 1984 and 2009
http://library.ucsd.edu/dc/object/bb4028552s/_2.jpg,"Sabemos algo, ignoramos algo... Paulo Freire","Centro de Documentación Tania Valentina Parada. Instituto de Investigación, Capacitación, y Desarrollo de la Mujer; Freire, João Paulo",between 1984 and 2009
http://library.ucsd.edu/dc/object/bb08203324/_2.jpg,Luchamos por la justicia social en libertad,Partido Liberal de Unidad Nacional (Nicaragua),between 1984 and 2009
http://library.ucsd.edu/dc/object/bb1502935q/_2.jpg,Voto Verde,Partido Conservador Demócrata de Nicaragua,between 1984 and 2009
http://library.ucsd.edu/dc/object/bb5018325x/_2.jpg,María Ramírez,"Frente Sandinista De Liberacion Nacional; Ramiírez, María",between 1984 and 2009
http://library.ucsd.edu/dc/object/bb3345952t/_2.jpg,El seguro siempre ha sido mi prioridad,"Martinelli Berrocal, Ricardo Alberto, 1952-; Partido Cambio Democrático (Panama)",between 1984 and 2009
http://library.ucsd.edu/dc/object/bb5939833w/_2.jpg,"Diputada Violeta Menjívar, San Salvador","Frente Farabundo Martí para la Liberación Nacional; Menjívar, Violeta",between 1984 and 2009
http://library.ucsd.edu/dc/object/bb6929605h/_2.jpg,Walter Coto Presidente 2000,"Coto Molina, Walter; Partido Liberación Nacional",between 1984 and 2009
http://library.ucsd.edu/dc/object/bb07862014/_2.jpg,"Voto Por La Paz, Voto Por FSLN",Frente Sandinista de Liberación Nacional,between 1984 and 2009
http://library.ucsd.edu/dc/object/bb3653122c/_2.jpg,Sigo Luchando!,"Frente Farabundo Martí para la Liberación Nacional; Hándal, Schafik Jorge; Partido Comunista de El Salvador",between 1984 and 2009
http://library.ucsd.edu/dc/object/bb36872522/_2.jpg,Pueblo Unido Sí,Pueblo Unido (Political party : Costa Rica),between 1984 and 2009
http://library.ucsd.edu/dc/object/bb62128732/_2.jpg,"Para la capital, mujeres al congreso!",Frente Republicano Guatemalteco,between 1984 and 2009
http://library.ucsd.edu/dc/object/bb2014883f/_2.jpg,Construyamos una Honduras diferente!,"Orlando Iriarte, Marco; Partido Demócrata Cristiano de Honduras",between 1984 and 2009
http://library.ucsd.edu/dc/object/bb1298156g/_2.jpg,"Diputado Carlos Castañeda, Sonsonate","Castaneda Magaña, Carlos Alfredo; Frente Farabundo Martí para la Liberación Nacional",between 1984 and 2009
http://library.ucsd.edu/dc/object/bb3857903v/_2.jpg,El Frente con la gente joven,Frente Republicano Guatemalteco,between 1984 and 2009
http://library.ucsd.edu/dc/object/bb22879222/_2.jpg,Consejo de Partidos Políticos,Consejo de Partidos Políticos (Nicaragua),between 1984 and 2009
http://library.ucsd.edu/dc/object/bb03425160/_2.jpg,Boleta Electoral Para Representantes A La Asamblea Nacional Región 6,Consejo Supremo Electoral (Nicaragua),between 1984 and 2009
http://library.ucsd.edu/dc/object/bb8090026r/_2.jpg,Gilberto Rincón Gallardo Presidente; vota differente,"Democracia Social (Political party :Mexico); Partido Comunista Mexicano; Partido Mexicano Socialista; Partido Socialista Unificado de México; Partido de la Revolución Democrática (Mexico); Rincón Gallardo, Gilberto",between 1984 and 2009
http://library.ucsd.edu/dc/object/bb30729138/_2.jpg,Schafik Presidente 2004,"Frente Farabundo Martí para la Liberación Nacional; Hándal, Schafik Jorge; Partido Comunista de El Salvador",between 1984 and 2009
http://library.ucsd.edu/dc/object/bb7578073k/_2.jpg,Por un Guatemala sin dueños ni patrones,"Castañeda, Oscar; Partido de Avanzada Nacional (Guatemala)",between 1984 and 2009
http://library.ucsd.edu/dc/object/bb3584862n/_2.jpg,Rebeca Flores Diputada Renovadora,Movimiento Renovador (El Salvador),between 1984 and 2009
http://library.ucsd.edu/dc/object/bb17759715/_2.jpg,Sigamos progresando en paz,"Castillo Morales, Carlos Manuel; Partido Liberación Nacional",between 1984 and 2009
http://library.ucsd.edu/dc/object/bb9728263d/_2.jpg,En Memoria de Mélida Anaya Montes,"Anaya Montes, Mélida; Frente Farabundo Martí para la Liberación Nacional",between 1984 and 2009
http://library.ucsd.edu/dc/object/bb01377339/_2.jpg,Presidente PINU el único camino,"Aguilar Paz, Enrique; Partido Innovación y Unidad (Honduras)",between 1984 and 2009
http://library.ucsd.edu/dc/object/bb5837445f/_2.jpg,Cumplimos continuemos,"Frente Farabundo Martí para la Liberación Nacional; Rivas Zamora, Carlos",between 1984 and 2009
http://library.ucsd.edu/dc/object/bb85337142/_2.jpg,Con toda seguridad!,"Mijangos, Elena; Unidad Revolucionaria Nacional Guatemalteca",between 1984 and 2009
http://library.ucsd.edu/dc/object/bb74074221/_2.jpg,Vota: tu voto es importante,"González, Xiomara; Unión del Cambio Nacionalista (Guatemala)",between 1984 and 2009
